{
  "$schema": "./extension-points-schema.json",
  "generatedAt": "2026-10-20T20:22:33.440Z",
  "version": "1.0.0",
  "commandCount": 18,
  "extensionPointCount": 77,
  "deprecatedExtensionPoints": [
    {
      "command": "work",
      "name": "pre-work",
      "deprecatedIn": "0.88.0",
      "removedIn": "0.88.0",
      "reason": "Consolidated /work from /workit hybrid shell (MANAGED, no extension points) — #2368"
    },
    {
      "command": "work",
      "name": "post-work-start",
      "deprecatedIn": "0.88.0",
      "removedIn": "0.88.0",
      "reason": "Consolidated /work from /workit hybrid shell (MANAGED, no extension points) — #2368"
    },
    {
      "command": "work",
      "name": "post-implementation",
      "deprecatedIn": "0.88.0",
      "removedIn": "0.88.0",
      "reason": "Consolidated /work from /workit hybrid shell (MANAGED, no extension points) — #2368"
    },
    {
      "command": "work",
      "name": "post-ac-verification",
      "deprecatedIn": "0.88.0",
      "removedIn": "0.88.0",
      "reason": "Consolidated /work from /workit hybrid shell (MANAGED, no extension points) — #2368"
    },
    {
      "command": "review-issue",
      "name": "pre-review",
      "deprecatedIn": "0.101.0",
      "removedIn": "0.101.0",
      "reason": "Retired with /review-issue converted to MANAGED (no extension points) — #2746"
    },
    {
      "command": "review-issue",
      "name": "criteria-customize",
      "deprecatedIn": "0.101.0",
      "removedIn": "0.101.0",
      "reason": "Retired with /review-issue converted to MANAGED (no extension points) — #2746"
    },
    {
      "command": "review-issue",
      "name": "post-review",
      "deprecatedIn": "0.101.0",
      "removedIn": "0.101.0",
      "reason": "Retired with /review-issue converted to MANAGED (no extension points) — #2746"
    }
  ],
  "commands": {
    "bug": {
      "type": "EXTENSIBLE",
      "description": "Create a bug issue from the IDPF framework's standard template.",
      "extensionPoints": [
        {
          "name": "pre-create",
          "location": "Between Step 2b (Detect Version) and Step 3 (Create Issue)",
          "purpose": "Add custom validation, enrichment, or pre-processing before the bug issue is created",
          "provenance": "unverified"
        },
        {
          "name": "post-create",
          "location": "Step 4 (Report and STOP), after issue creation",
          "purpose": "Add post-creation actions such as notifications, linking, or custom labeling",
          "provenance": "unverified"
        }
      ],
      "copyright": "Rubrical Works (c) 2026"
    },
    "catalog-screens": {
      "type": "EXTENSIBLE",
      "description": "Discover and catalog screen elements from source code, using the IDPF framework.",
      "extensionPoints": [
        {
          "name": "pre-catalog",
          "location": "Step 1 (Discovery and Interactive Setup), before content loading",
          "purpose": "Add custom discovery sources or configure catalog parameters before scanning",
          "provenance": "unverified"
        },
        {
          "name": "post-discovery",
          "location": "Step 3b (Manual Catalog Mode), after automated/manual discovery",
          "purpose": "Enrich or filter discovered elements before specification",
          "provenance": "unverified"
        },
        {
          "name": "post-catalog",
          "location": "Step 6b (Screen Spec Format), after screen specs written",
          "purpose": "Add post-catalog actions such as generating reports or updating cross-references",
          "provenance": "unverified"
        }
      ],
      "copyright": "Rubrical Works (c) 2026"
    },
    "ci": {
      "type": "EXTENSIBLE",
      "description": "Manage GitHub Actions CI workflows interactively, using the IDPF framework.",
      "extensionPoints": [
        {
          "name": "pre-add",
          "location": "/ci --add subcommand, before feature validation",
          "purpose": "Add custom validation or transformation before a CI feature is added to the workflow",
          "provenance": "unverified"
        },
        {
          "name": "post-add",
          "location": "/ci --add subcommand, after feature added to workflow",
          "purpose": "Run post-add actions such as testing the workflow or notifying the team",
          "provenance": "unverified"
        },
        {
          "name": "pre-recommend",
          "location": "/ci --recommend subcommand, before analyzing project stack",
          "purpose": "Inject custom signals or constraints before CI recommendations are generated",
          "provenance": "unverified"
        },
        {
          "name": "post-recommend",
          "location": "/ci --recommend subcommand, after recommendations presented",
          "purpose": "Add follow-up actions after recommendations are applied",
          "provenance": "unverified"
        },
        {
          "name": "custom-subcommands",
          "location": "Step 4 (Execute Handler), subcommand dispatch",
          "purpose": "Register custom CI subcommands beyond the built-in add/recommend/status",
          "provenance": "unverified"
        }
      ],
      "copyright": "Rubrical Works (c) 2026"
    },
    "create-branch": {
      "type": "EXTENSIBLE",
      "description": "Create a branch with a tracker issue, using the IDPF framework.",
      "extensionPoints": [
        {
          "name": "pre-create",
          "location": "Step 1 (Validate and Check Working Directory), after config check",
          "purpose": "Add custom pre-creation checks such as naming conventions or branch limits",
          "provenance": "unverified"
        },
        {
          "name": "post-create",
          "location": "Step 3 (Configure Branch), after branch pushed and labels set",
          "purpose": "Add post-creation actions such as setting up branch protections or notifications",
          "provenance": "unverified"
        }
      ],
      "copyright": "Rubrical Works (c) 2026"
    },
    "create-prd": {
      "type": "EXTENSIBLE",
      "description": "Transform a proposal into an Agile PRD using the IDPF framework.",
      "extensionPoints": [
        {
          "name": "pre-analysis",
          "location": "Phase 1 (Fetch Proposal from Issue), after loading proposal",
          "purpose": "Add custom proposal validation or enrichment before gap analysis",
          "provenance": "unverified"
        },
        {
          "name": "post-analysis",
          "location": "Phase 3 (Analyze Proposal Gaps), after gap analysis",
          "purpose": "Inject additional gaps or override gap severity before questions",
          "provenance": "unverified"
        },
        {
          "name": "pre-transform",
          "location": "Phase 4 (Dynamic Question Generation), before story transformation",
          "purpose": "Customize story transformation rules or add domain-specific story templates",
          "provenance": "unverified"
        },
        {
          "name": "post-transform",
          "location": "Phase 4.5 (Story Transformation), after stories transformed",
          "purpose": "Validate or adjust transformed stories before epic structuring",
          "provenance": "unverified"
        },
        {
          "name": "pre-diagram",
          "location": "Phase 5 (Priority Validation), before diagram style selection",
          "purpose": "Override diagram style or inject custom diagram requirements",
          "provenance": "unverified"
        },
        {
          "name": "diagram-generator",
          "location": "Phase 5.5b (Diagram Generation), diagram creation",
          "purpose": "Replace or augment the default diagram generator with a custom implementation",
          "provenance": "unverified"
        },
        {
          "name": "post-diagram",
          "location": "Phase 5.5b (Diagram Generation), after diagrams generated",
          "purpose": "Post-process generated diagrams or add supplementary visualizations",
          "provenance": "unverified"
        },
        {
          "name": "pre-generation",
          "location": "Phase 6 (Generate PRD), before document generation",
          "purpose": "Customize PRD template or inject additional sections before generation",
          "provenance": "unverified"
        },
        {
          "name": "post-generation",
          "location": "Phase 6 (Generate PRD), after PRD document written",
          "purpose": "Add post-generation actions such as review triggers or cross-references",
          "provenance": "unverified"
        },
        {
          "name": "quality-checklist",
          "location": "Phase 6 (Generate PRD), quality validation",
          "purpose": "Add project-specific quality checks beyond the default PRD quality criteria",
          "provenance": "unverified"
        }
      ],
      "copyright": "Rubrical Works (c) 2026"
    },
    "design-system": {
      "type": "EXTENSIBLE",
      "description": "Produce DTCG-compliant design tokens with a pluggable adapter architecture, using the IDPF framework.",
      "extensionPoints": [
        {
          "name": "discovery-adapters",
          "location": "Step 3 (Init Mode), after guided walkthrough",
          "purpose": "Register custom discovery adapters for extracting tokens from project-specific sources",
          "provenance": "unverified"
        },
        {
          "name": "export-adapters",
          "location": "Step 4 (Discovery Mode), after discovery completes",
          "purpose": "Register custom export adapters for outputting tokens in project-specific formats",
          "provenance": "unverified"
        }
      ],
      "copyright": "Rubrical Works (c) 2026"
    },
    "destroy-branch": {
      "type": "EXTENSIBLE",
      "description": "Safely delete a branch after confirmation, using the IDPF framework.",
      "extensionPoints": [
        {
          "name": "pre-destroy",